"title","price","url","description","district","source_id","city_id","image_data"
"2к. квартира, 57,8 м²","15 500 000","https://kazan.cian.ru/sale/flat/306429550/","Изысканная квартира, авторский дизайн, потолки 2,95м, все новое и высококлассное от кирпича. Все что на фото остается.
Отличнaя шумoизoляция, пpoстор, основательноcть и нaдeжнocть, высокие потолки, ж/б перекрытия.
В квартире выполнен качественный ремонт:
- Полная замена всех инженерных систем- электрики, водоснабжения, водоотведения и отопления;
- Новые окна с тройным остеклением;
- Пол: инженерная изностойкая дубовая паркетная доска, керамогранит от ведущих производителей;
- Интеллектуальное освещение, несколько режимов яркости;
- Сплит- система, Вы сами выбираете комфортную температуру в квартире. В отделке использовались только премиальные материалы высокого качества. 
Вся мебель изготавливалась на заказ по авторскому дизайн- проекту у ведущих производителей. Встроенная высококлассная техника  посудомоечная и стиральная машины, духовка, СВЧ, холодильник. Всё продумано до мелочей. 
Комфортный этаж, тишина и покой. Окна выходят в тихий зеленый двор. Респектабельные соседи, особая культура и атмосфера исторического центра Казани ( Вахитовский район )
Ваше окружение это новые клубные дома- 300 метров ЖК Квартал Сюита и ЖК Шаляпина, Кастура таун на Островского (600 метров), резиденция на Хади Атласи. Слева благоустроенная набережная озера Кабан, новый театр Галиаскара Камала  на Назарбаева (500 метров),",,,,
